title;artist;genre;power;key;bpm
Want It Back [L'Entourloop & Troy Berkley Remix];L'Entourloop, Guts, Patrice;Reggae, Vocal, Digital;3;Fm;83.0
La Musik;I Woks Sound;Reggae, Vocal, FR;2;Cm;90.0
Le Flow;I Woks Sound;Reggae, Vocal, FR;3;F#m;77.0
Lighters;Jahneration;Reggae, Vocal, Digital;3;G#m;86.0
Where I'm Coming From;Lila iké;Reggae, Vocal, Dub, Digital;3;C#m;71.0
De Ceux Qui Pensent;Bhale Bacce Crew, Lo;Reggae, Vocal, FR, Digital;2;C#m;90.0
Look To The Future - Cian Finn (Zion Train Remix);Cian Finn, ZIon Train;Reggae, Vocal, Digital;3;E;71.0
Hope is gone;Loucas Boyat;Reggae, Vocal, Digital, Dubadub;2;Gm;85.0
Bad Load;Lyricson;Reggae, Vocal, OS;3;Gm;80.0
Night and Day;Lyricson;Reggae, Vocal, Digital;3;Em;95.0
DIGITAL KINGSTON SESSION #3;ManuDigital, Papa Michigan;Reggae, Vocal, Digital;2;G;93.0
Dreamcatcher;Marina P, Stand High Patrol;Reggae, Dubadub, Dub, Vocal, Dubstep;2;G#m;86.0
Rosetta;Marina P, Stand High Patrol;Reggae, Vocal, Dubadub, Dub;2;Dm;73.0
Summer on Mars;Marina P, Stand High Patrol;Reggae, Vocal, Dubadub, Dub;2;G#m;84.0
Bite The Dust;Marina P, KSD;Reggae, Vocal, Digital, Dubadub, Downtempo;2;Em;120.0
CHINATOWN;Marina P;Reggae, Vocal, Digital, Dubadub;3;Cm;80.0
Libre;MC Madjah;Reggae, Vocal, Digital;3;Bbm;88.0
Babylon (Acoustic);Mango Seed;Reggae, Vocal, Accoustique;2;Am;
Crazy (LionRiddims Remix);ManuDigital, Taiwan Mc;Reggae, Vocal, Digital, Dub;3;F;75.0
Jah Gringo;Martin Jondo;Reggae, Vocal;2;Dm;80.0
Ma ville est malade;Massilia Sound System;Reggae, Vocal, OS, FR;3;Gm;94.0
Au marché du soleil;Massilia Sound System;Reggae, Vocal, OS, FR;3;Em;95.0
Real Lioness (Anti-Bypass Vocal Mix) [Lion's Den 2016];Massive Dub Corporation, Queen Omega;Reggae, Vocal, Digital, Dub, Steppa;2;Am;136.0
Masta KIM Freestyle Ganja Smoker;Masta Kim;Reggae, Vocal, Digital, Heavy;4;F#m;88.0
Be Careful dubplate Bhale Bacce;Bhale Bacce Crew, Matthew McAnuff;Reggae, Vocal, OS, Dub;3;Cm;135.0
Be Careful;Matthew McAnuff;Reggae, Vocal, OS;2;G#m;73.0
Max Romeo - Chase The Fascist (Bonnot's Dubplate);Max Romeo, Bonnot;Reggae, Vocal, OS;2;Em;75.0
Megamix Speed It Up ⁄ Spectacular ;Mahom, Jo Welders, Ashkabad;Reggae, Vocal, Digital, Dub;3;G#m;80.0
Strong;Mehdiman;Dub, Vocal, Digital;2;;73.000359
Fear Is Not A Solution;Mighty Seeds;Reggae, Vocal, Accoustique;2;Gm;80.0
Paradise;Mikey Dread;Reggae, Vocal, OS;2;Dm;136.0
Wire Fence;Mikey General;Reggae, Vocal;2;Em;73.0
Miss Fatty;Million Stylez;Reggae, Digital;2;Dm;82.0
Le 4éme Jour;Missah;Reggae, Vocal, FR, Digital;3;Cm;106.0
l'original ;Mista T;Reggae, Vocal, Digital;3;Eb;99.0
Movin' On;Indigo;Reggae, Vocal, Digital, Dubadub;2;Dm;71.0
Génération H ridim;Mr Lezard;Reggae, Vocal, FR;2;Em;80.0
Mr Marshall;Johnny Osbourne;Reggae, Vocal, OS;2;C#m;128.0
Mr Williamz & induhman;Mr WIlliamz, induhman;Reggae, Vocal, Digital, Dub;3;Gm;71.0
African ting riddim megamix;Mungo's Hi Fi;Reggae, Vocal, Digital, Dub;3;Gm;71.0
Industry ft Mr Williamz ⁄ Solomon riddim;Mungo's Hi Fi, Mr Williamz;Reggae, Vocal, Digital;2;E;76.0
Put it on ft. Shanti D;Mungo's Hi Fi, Shanti D;Reggae, Vocal, Digital;2;Gm;95.0
Back to My Roots;Mungo's Hi Fi, Charlie P;Reggae, Vocal, Digital, Dub, Dubadub;2;Em;80.0
Murder (Feat Charlie P & Brother Culture);Charlie P, Brother Culture;Reggae, Vocal, Digital, Dubadub;3;Fm;84.0
World Crisis;Murray Man;Reggae, Vocal, Digital, Dub;3;Cm;70.0
Rumours a gwaan (incut prod);Naâman;Reggae, Vocal, Digital;3;Cm;92.0
Natty Rides Again;Nattali Rize, Julian Marley;Reggae, Vocal, Digital;3;Fm;72.0
Natty Roots;Charlie P;Reggae, Vocal, Digital, Roots;3;Dm;75.0
Rebel For Life;Naâman, Cutty Ranks;Reggae, Vocal, Digital;3;Eb;86.0
BUN DI CHALICE;Naâman;Reggae, Vocal, Accoustique;2;Bm;89.0
High Basement - incut prod;Naâman;Reggae, Vocal, Accoustique;1;Ab;120.0
HOW MANY RIVERS (incut prod);Naâman;Reggae, Vocal;2;F#m;71.0
Lucky Day;Naâman;Reggae, Vocal;3;Fm;100.0
Never Get Back (Fatbabs Prod.);Naâman;Reggae, Vocal, Digital;3;Eb;91.0
Outta Road;Naâman;Reggae, Vocal, Digital;3;C;107.0
Rays Of Resistance Freestyle #2 - Run Away;Naâman;Reggae, Vocal, Accoustique;2;F;90.0
Smoke Tricks (Prod. By Fatbabs);Naâman;Reggae, Vocal, Accoustique;2;Eb;87.0
Hold On;Naâman, Randy Killah;Reggae, Vocal, Digital;2;Dm;83.0
Chill Out;Naâman, Massy & Triple;Reggae, Vocal, Digital;3;Gm;87.0
Hey Joe;Naâman, Massy & Triple;Reggae, Vocal, Digital;2;Em;87.0
Hold the People;Naâman, Massy, Triple;Reggae, Vocal, Digital;3;Bm;95.0
She Wanti;Naâman, Massy, Triple;Reggae, Vocal;2;F;80.0
Know Yourself;Naâman, Massy, Triple;Reggae, Vocal, Digital;3;Gm;85.0
One Love Style;Nianatty;Reggae, Vocal, OS;2;G#m;135.0
No Matter How Long It Takes;Stand High Patrol;Reggae, Vocal, Digital;2;Bbm;72.0
One People;Nattali Rize;Reggae, Vocal, Accoustique;2;A;74.0
La fume;Osiris MC;Reggae, Vocal, FR, Digital;2;G;75.0
Patrons;Osiris MC;Reggae, Vocal, FR, Digital;3;Em;83.0
A chacun son zion;Osiris MC;Reggae, Vocal, FR, Digital;2;B;85.0
Chacun sa place;Osiris MC;Reggae, Vocal, FR, Digital;3;Am;90.0
Dub Freestyle;Osiris MC;Reggae, Vocal, FR, Digital, Dub;3;Am;125.0
Ode a la Paresse;Osiris MC;Reggae, FR, Digital;2;G#m;88.0
Give I Fe I Name;Pablo Moses;Reggae, Vocal, OS;2;Cm;129.0
Abatachin Hoy - Perfect Giddimani (Billboard Artist-Producer);Perfect Giddimani;Dub, Vocal, Reggae;2;;122.999809
Please sing - Faiza;Faiza;Reggae, Vocal, Digital;3;Em;74.0
Poser Ma Vibe;Bhale Bacce Crew;Reggae, Vocal, FR, Digital;3;Cm;136.0
Positive Vibes;Davojah, Jahlix;Reggae, Vocal, Digital, Dub;3;4m;79.37516
Pressure;Irie Nanara;Reggae, Vocal, Digital;3;Gm;83.0
Lion Is a Lion;Pressure Busspipe;Reggae, Vocal, Digital;3;Gm;70.0
Resist Not Evil (Militancy Riddim);Protoje;Reggae, Vocal, Digital;3;Ebm;83.0
Rub A Dub Soldier ft. Ky-Mani Marley & Da Professor;Protoje, Ky-Mani Marley, Da Professor;Reggae, Vocal, Digital;3;Ebm;77.0
Earlydays In Session;Pupajim;Reggae, Vocal, Digital, Dubadub;2;Em;78.0
Puppa Djoul - Boomshot - HighSmileHiFi;Puppa Djoul, HighSmileHiFi;Dub, Vocal, Digital;2;;79.000862
Purify Your Heart;Johnny Osbourne;Reggae, Vocal, Dub;2;Em;73.0
Rebel Love;Nattali Rize, Notis, Zuggu Dan;Reggae, Vocal, Digital, Dub;2;Cm;80.0
WHOM SHALL I FEAR;Rob Symeonn;Reggae, Vocal;3;Bm;139.0
Me Nah Fed Up;Naâman, Jahneration;Reggae, Vocal, Digital;4;Cm;99.0
Rasta Love;Protoje, Ky-Mani Marley;Reggae, Vocal, Digital;3;Am;96.0
Reggae Musik;I Woks Sound;Reggae, Vocal, FR;2;Em;72.0
Reggae Vitamines;Osiris MC;Reggae, Vocal, FR, Digital, Dub;3;Em;75.0
Youth Dem Cold;Richie Spice;Reggae, Vocal;2;G#m;80.0
Rise Up feat. Dragon Davy & Ilements;Naâman, Ilements, Dragon Davy;Reggae, Vocal, FR;3;Dm;100.0
Roots Reggae Music (Dub Architect Remix Feat. Don Carlos And Katchafire);Dub Architect, Don Carlos, Katchafire;Reggae, Vocal, Digital;2;Cm;70.0
I Love Jah ⁄ I-Mitri - I Love Dub;S'Kaya, I-Skankers;Reggae, Vocal, Dub;3;Am;128.0
Joy (Feat Mungo's Hi Fi);S'Kaya, Mungo's Hi Fi;Reggae, Dub, Vocal, Digital;2;Am;86.0
Sensi Skank;ReggaeRoast;Reggae, Vocal, Digital, DnB;3;F#m;74.0
Inna Different Style;Shanti D;Reggae, Vocal, Digital, Dub, Dancehall;3;Gm;85.0
Shanti D⁄King Dynamite-Smugglers Tune ;Shanti D, King Dynamite;Reggae, Vocal, Digital;3;Dm;138.0
Kuff (Sub Alpine Remix);Shelly Thunder;Reggae, Vocal, Digital;3;;83.626656
Skanking Shoes;Naâman;Reggae, Vocal;3;Dm;95.0
Movie Star;Skarra Mucci, Delroy Wilson;Reggae, Vocal;3;Cm;91.0
Badman;Skillinjah;Reggae, Vocal, Accoustique;1;Dm;121.0
Emergency Spliff;Skillinjah;Reggae, Vocal, Accoustique;1;Bm;132.0
Miss Bell;Skillinjah;Reggae, Vocal, Accoustique;1;Dm;79.0
Ms. Light Brown;Skillinjah;Reggae, Vocal, Accoustique;1;E;82.0
Make It Bun Dem;"Skrillex, Damian ""Jr. Gong"" Marley";Reggae, Vocal;3;F#m;70.0
Jah Atmosphere;Soldiers of Jah Army;Reggae, Vocal, Accoustique;2;Em;120.0
Druids Of Stonehenge (Soul Mix);Soomt T, Stand High Patrol;Reggae, Jazz, Vocal;2;Gm;84.0
Did You Really Know;Mungo's Hi Fi, Soom T;Reggae, Vocal, Digital, Dub, Dubadub;2;Em;90.0
Boom Shiva;Soom T, Disrupt;Reggae, Vocal, Digital, Dub, Dubadub;3;F#m;83.0
Politik Man (Featuring Derajah);Soom T;Reggae, Vocal, Digital, Dub;3;Dm;135.0
Flying High;MC Soom-T;Reggae, Vocal, Digital, Dubadub;3;Bbm;80.0
Sous l'aube du jour;Mc Rozan, NA'JA;Reggae, Vocal, Dub;2;Cm;70.0
Ease Up The Pressure;Stalawa, Delroy Melody, C Wyne;Reggae, Vocal, Dub;2;Am;75.0
Stay Away Dubplate;Likkle Jordee, SD Massive Sound;Reggae, Vocal, Digital;3;Dm;70.0
Rock Stone;Stephen Marley, Capleton, Sizzla;Reggae, Vocal, Digital;2;Em;82.0
Someone to Love (acoustic);Stephen Marley;Reggae, Vocal, Digital;2;Bbm;83.0
Smokin' Love;Stick Figure, Collie Buddz;Reggae, Vocal, Digital;3;Gm;83.0
Struck You;City Kay;Reggae, Vocal, Digital;2;Em;90.0
Swing City;Youthie, Macca Dread;Regge, Vocal;2;Em;90.0
United;Sylford Walker;Reggae, Vocal, Roots, Dub;3;Em;126.0
The Answer l Jahneration (feat. Marion);Jahneration, Marion;Reggae, Vocal, Accoustique;2;Cm;120.0
On My Radio;The Selecter;Reggae, Vocal, Ska, OS;3;Bm;71.0
Ghost Town;The Specials;Reggae, OS, Vocal;3;Cm;74.0
On My Radio;The Selecter;Reggae, Vocal, Ska, OS;3;Dm;71.0
No Water In My Wine (feat. Biga Ranx);Tom Fire, Biga Ranx;Reggae, Vocal, Digital;3;Cm;88.0
Architects Of Chaos;Tom Spirals;Reggae, Vocal, Digital;3;G#m;85.0
Historical Knowledge + Dub;Tonto Addi;Reggae, Vocal, Digital, Dub, Dubadub;3;Cm;70.0
Peuples du monde;Tonton David;Reggae, Vocal, FR, Digital;2;Fm;92.0
Ole sound tradition ft General G & Ranking Levy;Trillion, Genral G, Ranking Levy;Reggae, Vocal, Dancehall;3;Gm;78.0
Red Red Wine;UB40;Reggae, Vocal, OS;2;Ebm;87.0
Un Constat;I Woks Sound;Reggae, Vocal, FR;2;Cm;78.0
ROCKADOWN - SUBWAY SESSION (FEAT. LIDIOP);Vanupié, Lidiop;Reggae, Vocal;2;F#m;70.0
Ragga music inna mi life;VirtuS;Reggae, Vocal, Digital;3;Ebm;86.0
Autodictée;Volodia;Reggae, Vocal, FR;3;Bm;105.0
Une minute de silence;Volodia;Reggae, Vocal, FR, Accoustique;2;Cm;75.0
War;Bob Marley, The Wailers;Reggae, Vocal, OS;2;Bbm;73.0
Who Dem a Program;Protoje;Reggae, Vocal, Digital;3;Ebm;85.0
General Sound (extended ⁄ Special mix for HowDoUDub);Wu.D'Sound, Green Cross;Reggae, Vocal, Dub;3;Ebm;132.0
Leave Babylon;Yehoud I / Odessa;Dub, Vocal, Digital, OS, Chill;2;9m;130.000168
Free Mandela (12 inch);Yami Bolo;Reggae, Vocal, OS, Dub;2;Am;135.0
dance cour, fume;Animajah;Reggae, Vocal, FR;3;Am;98.0
Calypso Blues;Calypso Rose;Reggae, Vocal;3;Gm;130.0
Inou wali;Filentre;Reggae, Vocal, FR;2;C;82.0
Goodness;The Ragga Panda;Reggae, instru, Melodic;1;C#m;77.0
"Passe-temps - Album ""Sans Frontires""";I Woks Sound;Reggae, Vocal, FR;3;Dm;90.0
Shoefiti;L'Entourloop, Marina Peloso;Reggae, Vocal;3;Cm;94.0
Fonk Monk;L'Entourloop, Soom T, N'Zeng;Reggae, Vocal, Sample;3;Fm;92.0
Los Cavos Anthem;The Ragga Panda;Reggae, Instru;3;Gm;71.0
Own Yourself;Naâman;Reggae, Vocal, Accoustique;2;G#m;87.0
Je te parle d'un temps;Osiris MC;Reggae, FR, Rap, Digital;3;G#m;94.0
Soulstorm;Patrice;Reggae, Vocal;3;Am;70.0
go back home;Naâman;Reggae, Vocal, Accoustique;1;Eb;90.0
You and Me (feat. Chris Boomer);SOJA;Reggae, Vocal, Accoustique;2;Em;114.0
Sunset Storm;The Ragga Panda;Reggae, Instru;3;Em;75.0
good skank riddim;Daddy Cookiz, RadikaSound;Reggae, Vocal, FR;3;Am;71.0
Oak Tribe;Black Oak Dub;Dub, Instru, Digital, Progressive;3;;170.000397
Praise the sun;Black Oak Dub;Dub, Instru, Reggae, Chill;2;;151.999008
Roar of the earth;Black Oak Dub;Dub, Instru, ElectroDub, Steppa;3;;129.999893
Roar of the earth24bits;Black Oak Dub;Dub, Instru, ElectroDub, Steppa;3;;129.999924
Festin Fast;Bhale Bacce Crew;Reggae, Vocal, FR, Digital;2;Fm;92.0
Ils sont Sourds;Bhale Bacce Crew;Reggae, Vocal, FR;2;C#m;85.0
Ils Grignottent la Terre;Bhale Bacce Crew;Reggae, Vocal, FR;2;Fm;101.0
Sexe Fort;Bhale Bacce Crew;Vocal, FR, Rap;2;Ebm;96.0
On n'a pas tous la même couleur;Bhale Bacce Crew;Reggae, Vocal, FR, Digital;2;G#m;87.0
Style & Fashion;Bhale Bacce Crew;Reggae, Vocal, FR, Digital;2;Ebm;89.0
On fait avec;Bhale Bacce Crew;Vocal, FR, Rap;2;Dm;95.0
Positifs;Bhale Bacce Crew;Reggae, Vocal, FR, Digital;3;Am;90.0
Révolution de Canap';Bhale Bacce Crew;Reggae, Vocal, FR;2;Em;85.0
Espoir d'un Jour;Bhale Bacce Crew;Reggae, Vocal, FR, Digital;2;Em;86.0
On n'oublie pas;Bhale Bacce Crew;Vocal, FR, Rap;2;Gm;100.0
Parents;Bhale Bacce Crew;Reggae, Vocal, FR;2;Dm;80.0
EgoLo;Bhale Bacce Crew;Vocal, FR, Rap;3;Am;102.0
Où est le peuple ?;Bhale Bacce Crew;Reggae, Vocal, FR;2;Am;86.0
International One Love;Bhale Bacce Crew;Reggae, Vocal, FR, Dub;2;Dm;103.0
Ils sont Sourds (Version 2016);Bhale Bacce Crew;Reggae, Vocal, FR;2;Fm;85.0
Most Dub;Bhale Bacce Crew;Dub, Instru, Digital;3;Am;80.0
Pas de temps à perdre;Bhale Bacce Crew;Reggae, Vocal, Digital, FR, Ska;3;Ebm;124.0
Fondations;Bhale Bacce Crew;Reggae, Vocal, FR;3;Am;80.0
Lord of War;Bhale Bacce Crew;Reggae, Vocal, Sample, FR, Rap;2;Bbm;91.0
Most High;Bhale Bacce Crew;Dub, Vocal, Digital;3;Am;80.0
Peur de l'autre;Bhale Bacce Crew;Reggae, Vocal, FR;2;Am;82.0
La formule;Bhale Bacce Crew;Reggae, Vocal, FR;2;Am;72.0
Vilénies;Bhale Bacce Crew;Vocal, FR, Rap;2;G#m;87.0
Combine & Son;Bhale Bacce Crew;Reggae, Vocal, FR;3;Bm;100.0
Ça brûle (feat. Root Spirit);Bhale Bacce Crew;Reggae, Vocal, FR;3;Dm;90.0
N.Y.C.;Bhale Bacce Crew;Reggae, Vocal, FR, Rap;2;Am;90.0
Que Pasa;Bhale Bacce Crew;Vocal, FR, Rap;2;Ebm;76.0
Fever;Bhale Bacce Crew;Reggae, Vocal, Digital, Dub;2;Dm;75.0
Cet homme;Bhale Bacce Crew;Reggae, Vocal, FR;2;Cm;85.0
Tous nos regrets;Bhale Bacce Crew;Vocal, FR, Rap;2;G#m;93.0
Fin de la récré;Bhale Bacce Crew;Reggae, Vocal, FR;3;Fm;95.0
Children;Bhale Bacce Crew;Reggae, Vocal, Digital;2;Em;80.0
Inna me yard;Mr Monkey D;Reggae, Digital, Hip hop, Vocal;3;Bm;100.0
Shinjirarenai;Mr Monkey D;Hip hop, Vocal;3;G#m;93.0
Hold on;Mr Monkey D;Hip hop, Vocal;2;Gm;92.0
Lion Anthem;Mr Monkey D;Reggae, Digital, Vocal, Dub;3;Gm;85.0
Another bright day;Mr Monkey D;Hip hop, Vocal;3;Am;105.0
It's work for us;Mr Monkey D;Hip hop, Vocal;2;Cm;89.0
Good old times;Mr Monkey D;Hip hop, Vocal;2;Fm;90.0
Freedom;Skunk Kut, Monkey D;Reggae, Vocal, Digital, Dub;2;Cm;70.0
Sweet Mary;Skunk Kut, Monkey D;Reggae, Vocal, Dub;2;Bm;72.0
Longtime;Skunk Kut, Monkey D;Reggae, Vocal, Digital;2;Gm;90.0
I'll be there;Skunk Kut, Monkey D;Reggae, Vocal, Digital;2;Bbm;90.0
Falacious World;Skunk Kut, Monkey D;Reggae, Vocal, Digital;3;Am;87.0
RockSteady feat Jennifer Paulos;Skunk Kut, Monkey D;Reggae, Vocal, Digital;3;Cm;130.0
How Many Roses (Intimate Version);Skunk Kut, Monkey D;Reggae, Vocal;2;Dm;80.0
Schizo;Bhale Bacce Crew, Marina P;Dub, Vocal, FR, Digital;3;Cm;135.0
ZionMonk;Bhale Bacce Crew;Dub, Vocal, Digital, ElectroDub;2;F#m;78.0
I Got;Marina P, Ondubground;Reggae, Vocal, Digital, ElectroDub;3;F#m;94.0
I Dub;Marina P, Ondubground;Reggae, Vocal, Digital, ElectroDub;4;F#m;94.0
On sera beau;Bisou, Suzanne Leo;Dub, Vocal, FR, Digital, Reggae;2;E;130.0
Morning;Stand High Patrol;Reggae, Vocal, Intro;1;Am;85.0
Sailing in Rough Seas;Stand High Patrol;Reggae, Dubadub, Vocal;2;Fm;70.0
Blues;Stand High Patrol;Dub, Vocal, Dubadub, Digital;3;Cm;71.0
Dub O'clock;Stand High Patrol;Dub, Vocal, Reggae, Dubadub;3;C#m;83.0
Along the River;Stand High Patrol;Dub, Vocal, Digital, Dubadub, Reggae;3;Am;74.0
The Factory;Stand High Patrol;Dub, Vocal, Reggae, Dubadub;2;F#m;136.0
In the Park;Stand High Patrol;Reggae, Vocal, Jazz;2;G#m;95.0
Rain on the window;Stand High Patrol;Reggae, Instru, Dubadub;1;A;120.0
Jay's Life;Stand High Patrol;Reggae, Vocal, Dubadub;2;Em;120.0
Every Plane;Stand High Patrol;Reggae, Vocal, Dubadub;2;Cm;120.0
Belleville rap;Stand High Patrol;Reggae, Vocal, Dubadub, Rap, FR;2;Gm;84.0
The Train;Stand High Patrol;Dub, Reggae, Instru;3;Am;125.0
Our Own Way;Stand High Patrol;Dub, Vocal, Dubadub, Digital;3;G#m;75.0
The sound of nature;Stand High Patrol;Reggae, Vocal, Dubadub, Jazz;2;Gm;89.0
Rainy ragga;Stand High Patrol;Reggae, Vocal, Intro, Dub;2;Am;81.0
D funk;Stand High Patrol;Reggae, Instru, Dub;2;Cm;129.0
Last day of winter;Stand High Patrol;Reggae, Vocal, Dubadub, Digital, Dub, Downtempo;2;Am;139.0
STORM;Hoofander;Dub, Instru, Digital, Steppa, Melodic;2;2m;127.999176
GOOD & EVIL Feat. D2S-HIFI;Hoofander, D2S HIFI;Dub, Instru, Digital, ElectroDub, Steppa;3;10m;123.999962
POWER;Hoofander;Dub, Instru, Digital, Steppa, Melodic;2;10m;127.999374
NIGHTMARE;Hoofander;Dub, Instru, Digital, Steppa;3;10m;135.999084
WILD SOCIETY Feat. Stepper Skanker;Hoofander, Stepper Skanker;Dub, Instru, Digital, ElectroDub, Steppa;3;1m;152.999573
Hardcore Dub;Mandala Sound;Dub, Instru, Digital, Steppa;4;7m;140.999786
Spicy Dub feat. King Joe;Mandala Sound, King Joe;Dub, Vocal, Digital, ElectroDub, Steppa, Progressive;3;9m;80.499916
Soundclash;Mandala Sound;Dub, Instru, Digital, ElectroDub;3;11m;59.99992
Shamanik Trance;Mandala Sound;Dub, Vocal, Digital, ElectroDub, Steppa, Oriental;3;9m;130.99968
Animal Thingz;Mandala Sound;Dub, Instru, Digital, ElectroDub, Steppa;4;7m;154.999725
What You Do? (Ranking Joe Remixed);Mandala Sound, Ranking Joe;Dub, Vocal, Digital, ElectroDub;3;2m;130.00032
Massaï Travel;Mandala Sound;Dub, Instru, Digital, ElectroDub, Steppa;4;2m;154.999725
Pon Di Version feat. Smad;Mandala Sound, Smad;Dub, Vocal, FR, Digital, ElectroDub, Steppa;3;12m;133.999817
Savage;Mandala Sound;Dub, Instru, Digital, ElectroDub, Steppa;3;12m;133.000153
Step by step;Owl Tracker;Dub, Instru, Digital, Steppa, Chill;3;;133.999893
Locked on street;Bouture Dub;Dub, Instru, Digital, Steppa, Chill;2;;131.999786
Crying Soul;Karabasse;Dub, Instru, Digital, Steppa, Chill;2;;134.000717
Rumble;Dub Heaven;Dub, Instru, Digital, Steppa;3;;64.999947
Return Of The Lion;ShaYaman;Dub, Instru, Digital, Steppa, Slow;2;;122.000107
Immunity;The Heartikalist;Dub, Instru, Digital, Steppa;3;;122.370186
Neighbourhood complain;Stormwise;Dub, Instru, Digital, Steppa;3;;120.000305
Tribute to King Earthquake;Toltek;Dub, Instru, Digital, Steppa;3;;129.999649
Woman of the world;Rawll Starz;Dub, Vocal, Digital, Steppa, Chill;2;;70.0
Coyote Footprints;Val Tribulation;Dub, Instru, Digital, Steppa;3;;136.999985
Pure riddim;Prince François Far I;Dub, Instru, Digital, Dirty;2;;135.000214
Mighty spring;Ras Rodrigue;Dub, Instru, Digital, Steppa, Dirty;3;;129.999817
Blood 4 Blood Part. 2 (Feat. Zayin Dub);Toltek, Zayin Dub;Dub, Instru, Digital, ElectroDub, Steppa;3;6m;148.000153
Blood 4 Blood (Feat. Zayin Dub);Toltek, Zayin Dub;Dub, Instru, Digital, ElectroDub, Steppa;3;6m;73.999893
Blood 4 Blood Part.3 (Feat. Zayin Dub);Toltek, Zayin Dub;Dub, Instru, Digital, ElectroDub, Steppa, Dirty, Progressive;3;6m;147.998383
Blood 4 Blood Part.4 (Feat. Zayin dub);Toltek, Zayin Dub;Dub, Instru, Digital, ElectroDub, Steppa;3;9d;147.999329
Healing Of The Nation (Original Mix);Vibronics, Parvez;Dub, Vocal, Digital;3;1m;134.999985
Healing Of The Nation (Dub);Vibronics, Parvez;Dub, Instru, Digital;3;1m;135.000626
Healing Of The Nation (Bim One Remix);Vibronics, Parvez;Dub, Vocal, Digital;2;1m;134.999832
Healing Of The Nation (Bim One Dub);Vibronics, Parvez;Dub, Instru, Digital;3;1m;134.999893
Healing Of The Nation (Dub 2) [BANDCAMP EXCLUSIVE];Vibronics, Parvez;Dub, Instru, Digital;2;1m;134.999985
Healing Of The Nation (Raw Mix) [BANDCAMP EXCLUSIVE];Vibronics, Parvez;Dub, Instru, Digital;3;1m;135.000534
Healing Of The Nation (Bim One Instrumental) [BANDCAMP EXCLUSIVE];Vibronics, Parvez;Dub, Instru, Digital, Riddim;2;1m;134.999832
Fuzzin In Di Town Dub;Penny Rasta;Dub, Instru, Digital, OS, Chill;2;1m;126.127068
Legalize It (Gossensei's Dub Mix feat. Ilias Lintzos);Friendly Fire Band, Ilias Lintzos;Dub, Vocal, Digital;3;11d;69.999893
Indica Dubwise (Homegrow Mix);T-Jah;Dub, Vocal, Chill, OS;2;11m;69.999992
Obeah Session (Stepper Version);T-Jah, Kuriooki, System D;Dub, Vocal, Digital, Chill, Steppa;2;8m;143.000061
Cyan't Stop Dub - Tape Version;Toni Wobble;Dub, Instru, Digital, Steppa;3;1m;139.999451
Conquering Lion Dubplate;JWL, Miles Won;Dub, Instru, Digital, Steppa;3;3m;130.000412
Skenga Revisited feat. Art-X;T-Jah, Kuriooki, Art-X;Dub, Vocal, Digital, Chill;2;2d;69.999985
Der Heide feat. Gjaezon;Basskateers, Gjaezon;Dub, Instru, Digital, ElectroDub;3;12m;69.499802
Social Rub A Dub feat. Capra Dread;High Smile Hi Fi, Capra Dread;Dub, Vocal, Digital, Dubadub, Chill;2;10m;85.000015
Dub Fi Life;Penny Rasta;Dub, Instru, Digital, Chill;2;7m;63.999542
Dub & Wine feat. Thomas Blasko (Dubplate Version);Kuriooki, T-Jah, Hairl Dub, Thomas Blasko;Dub, Instru, Digital, Steppa, Chill;2;8m;115.999275
Sideways (Vocal Mix);Dub Across Borders;Dub, Vocal, Digital, Chill;3;1d;119.999893
Dub Across Borders - Sideways (Dub Mix);Dub Across Borders;Dub, Instru, Digital, Chill;3;1d;119.999489
Da Secret feat. Senor C;Toni Wobble, Senor C;Dub, Instru, Digital, Steppa, Progressive;3;12m;70.000069
Be Like Water;Kuriooki;Dub, Instru, Digital, Chill;2;2m;144.999619
Eyes Dub;Jahdubtahz;Dub, Instru, Digital, Chill;2;2m;71.999817
Mariana Trench;Seahorse;Dub, Instru, Digital, ELectroDub;2;1m;193.499802
Mother feat. Katya Tasheva;Beam Up, Katya Tasheva;Dub, Vocal, Digital, Chill;3;;139.999786
Babni;Beam Up;Dub, Instru, Digital, OS, Steppa, Chill;3;8m;139.999039
Babti;Dub Across Borders;Dub, Instru, Digital, OS;2;8m;69.999863
Life Is Easier (T-Jahs Vocal Dub);Dub Shepherds, Joe Pilgrim, T-Jah;Dub, Vocal, Digital, Progressive;3;2m;129.000366
Ganjapesto (Discomix);T-Jah, Dub Orchestra;Dub, Instru, Digital, OS, Chill;2;12m;68.179001
Jah Calling;Toroki, Isayah;Dub, Vocal, Digital, Chill;2;1m;84.000267
Golgo 13;The Monotrones, Yugo Taguchi;Dub, Vocal, Digital, Chill;2;7m;85.005745
Like A Fish (Melodica Version);Toni Woblle;Dub, Instru, Digital, Steppa, OS;3;10m;140.000854
Creation;Abba Ismail, Beli, Miles Won;Dub, Instru, Digital, Steppa;3;1m;129.00029
Castle Dub;Small Town Dubz;Dub, Instru, Digital, Steppa;4;1m;130.00029
Dub Generator;Jah Schultz;Dub, Instru, Digital, ElectroDub, Slow;3;12m;119.999275
Da Spring Thing (Drum N Tubby Version);Basskateers, Drum N Tubby;Dub, Instru, Digital, Other;2;4d;77.000481
Sensi I-Wah;Dub Across Borders, Canaan I;Dub, Vocal, Digital, ElectroDub, Slow;2;1m;99.99987
Simplifoniczingis;Kuriooki;Dub, Instru, Digital, Other, Chill;2;6m;71.999268
Triton;Bukkha, Joyful Lion;Dub, Instru, Digital, Chill;2;10m;92.999832
Histrix;Seahorse;Dub, Instru, Digital, Heavy, Slow;3;9m;70.000168
Mash It Dub;Goosensei;Dub, Instru, Digital, ElectroDub, Slow;3;1m;69.99971
Lazy Man (Feat. Charlie P);Adam Prescott;Dub, Vocal, Dubadub, Digital, Steppa;3;;140.000198
Lazy Man (Iration Steppas Year 3000 Dub);Adam Prescott, Charlie P, Iration Steppas;Dub, Instru, Digital, ElectroDub, Steppa;3;;70.003593
Lazy Man (Version);Adam Prescott, Charlie P;Dub, Instru, Digital, Steppa, Chill;2;;140.000107
Stand Firm (Original Mix);Adam Prescott, Charlie P;Dub, Vocal, ElectroDub, Slow;3;;70.000137
Stand Firm (Version);Adam Prescott, Charlie P;Dub, Instru, ElectroDub, Dubstep;3;;69.999962
Stand Firm (Tradesman Remix) - Charlie P;Adam Prescott, Charlie P, Tradesman;Dub, Vocal, Dancehall, Dubadub;2;;84.000839
Stand Firm (Tradesman Remix Version);Adam Prescott, Charlie P;Dub, Instru, Dancehall, Chill;2;;84.000549
Guide I&I part 1;Blackboard Jungle, DRH Hi-Fi;Dub, Instru, ElectroDub, Steppa, Melodic;4;;70.000168
Guide I&I part 2;Blackboard Jungle, DRH Hi-Fi;Dub, Instru, ElectroDub, Steppa, Melodic;4;;70.00029
Hiboo part 1;Blackboard Jungle, DRH Hi-Fi;Dub, Instru, OS, Chill;3;;130.000259
Hiboo part 2;Blackboard Jungle, DRH Hi-Fi;Dub, Instru, OS, Chill;3;;129.999741
Traveling On The Riddim (Ishiban Gears Dubplate);Ishiban, Sensi T;Dub, Vocal, ElectroDub, Steppa;4;3m;130.002472
Mr President;L'Entourloop, Skarra Mucci;Reggae, Vocal, HipHop;3;;95.000221
Gelato #33;L'Entourloop, Skarra Mucci;Reggae, Vocal, HipHop;3;;89.99955
Tell Dem Again (feat Blabbermouf);L'Entourloop, Skarra Mucci, Blabbermouf;Reggae, Vocal, HipHop;4;;90.500015
Mucci Mata;L'Entourloop, Skarra Mucci;Reggae, Vocal, HipHop;3;;97.999924
Da Legacy;L'Entourloop, Skarra Mucci;Reggae, Vocal, HipHop;3;;94.99942
Bangarang;L'Entourloop, Skarra Mucci;Reggae, Vocal, HipHop, Electro;3;;61.499931
Flygskam;Javinz;Dub, Instru, Chill, Melodic;2;11m;95.999092
La révolution du bruit;Javinz;Dub, Instru, ElectroDub, Chill, Melodic;2;4m;137.999756
LBDub;Javinz;Dub, Instru, Sample, FR, ElectroDub, Chill, Melodic;2;1m;132.000137
Mascaret;Javinz;Dub, Instru, ElectroDub, Chill, Melodic;2;12m;130.000046
Ayawaska;Javinz;Dub, Instru, ElectroDub, Chill, Melodic;3;1d;92.500244
Global Warning;Javinz;Dub, Instru, ElectroDub, Chill, Melodic;2;12m;131.999863
ZAG;Javinz;Dub, Instru, ElectroDub, Chill, Melodic;3;3m;150.000443
Métamorphose;Javinz;Dub, Instru, ElectroDub, Chill, Melodic;3;11m;157.999603
Oasis;Javinz;Dub, Instru, ElectroDub, Chill, Melodic;3;11m;140.0
Travelling dub;Mr Zebre;Dub, Instru, ElectroDub, Steppa;3;;152.000458
Travelling on the riddim;Mr Zebre, Sensi T;Dub, Vocal, ElectroDub, Steppa;4;;152.000381
Stand Firm (Dubbing session) #rootsbus E1;Lewiss Benett, Sista Oona;Dub, Vocal, Steppa;3;12m;134.999512
Same Justice;Stand High Patrol;Reggae, Vocal, Dubadub, Sad;2;;91.999916
Rise Up;Vibronics;Dub, Vocal, Steppa;3;;134.99675
Flying;Smither, Skonc;Techno, House;2;11d;121.999985
Free, Get Up;Smither, Hotblood;Techno, House;2;11d;123.999039
Back to Music;Smither, Nikko;Techno, House;2;2m;119.999924
It's a Destiny;Smither;Techno, House;3;12d;120.0
People;Smither;Techno, House;2;12d;121.999878
False Profit - #streetdub E25;Alpha Steppa, Nai-Jah, Joe Pilgrim, Setondji Spirit;Dub, Vocal, Steppa;3;Ebm;137.0
Psychoidub;Panda Dub;Dub, Instru, ElectroDub, Steppa;3;3m;80.000298
Azss;Panda Dub;Dub, Instru, ElectroDub, Steppa, Progressive;3;7m;138.000641
Leave Babylon + Dub - Alpha Steppa;Alpha Steppa, Odessa, Yehoud-I;Dub, Vocal, Digital, Chill;3;;130.000244
Black Soulie - Crisis;Panda Dub, Black Soulie;Dub, Vocal, Digital, Steppa, Chill;3;9m;124.786377
