title;artist;genre;power;key;bpm
Truck Driver Remix_2;GSS Sound, Sensi T;Dub, Vocal, Digital, ElectroDub;3;Am;152.000809
True Love;The Ragga Panda;Dub, Instru;3;Am;71.500175
Breakfast;Tsunami Wazahari;Dub, Instru, Steppa, Digital;3;F#m;117.00013
DubBird;Tsunami Wazahari;Dub, Instru, Steppa, Digital;3;Am;127.000099
FireBird;Tsunami Wazahari;Dub, Instru, Steppa, Digital;3;Am;127.000092
Chakra Rules;Tsunami Wazahari;Dub, Instru, Digital, Steppa;3;G#m;131.000183
Revelation;Tsunami Wazahari, Saimn-I;Dub, Vocal, Dubadub;3;G#m;128.000488
Tuff Like Iron;Queen Omega, Iron Dubz;Dub, Vocal;4;Em;155.994858
Tuffy Stepp;DPHdub;Dub, Instru, Digital, Steppa;4;Gm;149.999573
Turn off the radio;Brainless, Tenor Youthman;Dub, Vocal, Steppa, Digital;4;Em;159.999741
Get Lively Now (Dreadsquad Remix);Brother Culture, Turntable Dubbers, Dreadsquad;Dub, Vocal, Reggae, DownTempo, Digital;2;Bm;105.000031
Diet Dub;Dub Invaders, Twelve;Dub, Vocal, Digital, ElectroDub, Heavy, DubTek;4;3m;81.999794
Uprising;Massilia Hi-Fi, Arcuate;Dub, Steppa, Digital, Instru;4;B;126.000435
Uk raw;??;Dub, Instru, Digital;3;;133.999863
Un simple voyage;Digiman Dub;Dub, Steppa, Instru, Digital;3;Dm;93.000122
Unconsious;Digiman Dub;Dub, Steppa, Digital, Instru;3;Cm;152.210037
Under Mi Sensi Remix - Barrington Levy ;Barrington Levy, Digital Seal Hifi;Dub, Vocal, Digital;3;;150.999985
Unity ;The Ragga Panda;Dub, Exclu, Instru;3;Am;67.499962
Unity feat Prince David;Zion Train, Prince David;Dub, OS, Vocal, Reggae;3;Gm;139.999741
Unknown Attack;Panda Dub;Dub, Heavy, Digital, Steppa, Electrodub;5;Fm;156.000061
Get your body out;Don Alduck Dubwise;Dub, Heavy, Triphop, Vocal;4;Dm;77.500099
Together Mighty;Urban Lions;Dub, Vocal, Digital, Steppa, OS;4;Em;146.010513
Urban Tree;All Vibes Hi-Fi;Dub, Digital, Heavy, Instru;4;Bm;127.999924
Uzul - Rub a dub train Ft. MiCro Mano;Uzul, Micro Mano;Dub, Vocal, Digital, Steppa;4;G#m;144.999481
VIRTUS feat RadikalSound _Dubplate ska;Virtus, RadikalSound;Dub, Vocal, Ska;3;Gm;133.999939
Vampayaa (Original Mix);Tayo, Acid Rockers, Pupajim;Dub, Vocal, Digital, Dubstep, Dubadub;2;Ebm;139.999741
Vaporize;Tiburk;Dub, Instru, Steppa, Digital, Prog;4;Dm;85.000153
VarieDub Ft Tunelon Iration_Wicked Sound - Variedub;VarieDub, Tunelon Iration;Dub, Vocal, Digital;3;B;150.000198
Venetian Walk;DPH Dub;Dub, Digital, Steppa, Instru;3;F;159.999771
Dub Infinity'(10' Roots Youths Records);Vibronics;Dub, Insru, Digital, Steppa;4;Ebm;134.007889
Vicious Spiral;Chayko;Dub, Instru, Digital, ElectroDub, Steppa;4;Fm;139.997498
Vieille Branche;Biga Ranx;Dub, Vocal, FR, Digital, Dubadub, Electrodub;2;Am;129.999939
Violin Step Alpha Steppa Remix;Ashanti Selah;Dub, Steppa, Instru;3;C#m;123.999634
Brixton;Violinbwoy;Dub, Instru, Heavy, Dub, Steppa;4;Am;71.999733
Brixton Warrior Ver 2;Violinbwoy;Dub, Instru, Steppa, Heavy;4;Am;72.000259
General Verse I;Violinbwoy;Dub, Vocal, Digital, Electrodub;3;Am;69.999725
See I Dread;Violinbwoy;Dub, Vocal, Heavy, Digital;4;Am;133.499817
Wanted;Violinbwoy, Dan I;Dub, Vocal, Digital;3;Cm;57.499893
W A R - DUBPLATE by EKSMAN & ESTUDIO TRES (2 VERSÍCULOS);Eksman, Estudio Tres;Dub, Instru, Digital;3;Em;140.006638
W.A.R.;Ondubground, Pupajim, Biga Ranx, Bob Marley;Dub, Vocal, Digital;4;Bm;85.999832
Warrior Lights Dub 1;Stepwizer;Dub, Instru, Digital, Electrodub;3;G#m;156.000153
Bömbletörss';Winston Dub Project, Askata;Dub, Instru, Digital, Viking;2;Em;74.999748
WRATH OF THE JUNGLE;Dacadub, Wicked Steppa;Dub, Instru, Digital, Heavy;4;Em;74.999985
Better Days;KillaSoundYard;Dub, Vocal, Digital, Dubadub;4;C#m;143.000031
Lark;WZ;Dub, Instru, ElectroDub, Dubstep;4;C#m;69.999954
Walk To Zion;All Vibes Hi-FI;Dub, Instru;3;Ebm;65.999657
Indian Dance;Walking Mess;Dub, Instru, Digital;3;Am;65.007957
Walloheen Steppa;The Ragga Panda;Dub, Instru, Digital, Steppa;3;;131.000366
Bali Sound (Version Violin);Wardrobe Sound;Dub, Instru;3;;149.998825
Warehouse;Stand High Patrol;Dub, Heavy, Instru, Digital;4;Ebm;139.002289
Warriah;TWM;Dub, Steppa, Digital, Vocal;4;F;69.000114
Warrior - Youthman Skanker Dubmaker;Youthman Skanker;Dub, Instru, Digital, Steppa, Heavy;4;Gm;137.000824
Warrior Dub;Miniman;Dub, Instru;4;Am;147.000153
Warrior Dub;The Ragga Panda;Dub, Steppa, Sax, Instru;4;Em;61.49995
Warrior Dub Station;Bisou;Dub, Steppa, Electrodub, Instru, Digital;4;Bbm;130.0
Warrior Pain;Natural Skankers;Dub, Steppa, Digital, Instur;3;;135.000244
Warrior;Murray Man, Haspar;Dub, Vocal;4;Am;140.004578
Warriyah Hatsen;Mustical Dub;Dub, Digital, Steppa, Heavy, Instru;5;Fm;143.999557
Waste of time ⁄  Work in progress;Dub Wander;Dub, Instru, Digital;4;Bbm;146.999268
We play music /Nozéabondstylé  ( Digital Seal Records );Digital Seal Hifi;Dub, Vocal, Dubadub, Digital;2;Fm;144.999802
Weather Independent;High Foxx;Dub, Instru, Digital, Steppa;4;;143.999863
Gypsy Dub;Weeding Dub, Ras Divarius;Dub, Instru, Steppa;3;Fm;142.016266
African Shrine;Weeding Dub;Dub, Instru, Digital;3;;135.999191
Dub Shrine;Weeding Dub;Dub, Instru, Digital;3;;136.000183
Dub Shrine - unreleased mix-;Weeding Dub;Dub, Instru, Digital;3;;135.999207
Freedom ft.Sama Renuka - Kandee remix;Welders Hi-Fi, Sama Renuka, Kandee;Dub, Vocal, Digital;3;Gm;137.999908
Fyah - Wellette Seyon & Dub Conductor;Wellette Seyon, Dub Conductor;Dub, Vocal, Digital;3;;144.99968
Whenever I Go;Mad Skanker;Dub, Vocal, Digital;2;Cm;178.499725
Whiplash-Skunk kut;Skunk Kut;Dub, Vocal, Sample, ElectroDub, Steppa;3;;75.000008
White Paper dub (Dubbytek re-dub);Dubbytek, Protoje;Dub, Steppa, Vocal;4;Bbm;144.000031
White Paper dub (Protoje x Gappy Ranks);Dubbytek, Protoje, Gappy Ranks;Dub, Steppa, Vocal;4;Fm;143.999924
Who Can You Call;Protoje;Dub, Reggae, Vocal;3;Ebm;135.99913
Why so Serious¿ (feat. Tenor Youthman)!;Alpha Steppa, Tenor Youthman;Dub, Vocal;2;G#m;154.000107
Wicked Dub;Captain Maxx;Dub, Vocal, Heavy, Steppa;4;;140.001526
Wicked Dub Division meet Mannaro Man - Deliver Me;Wicked Dub Division, Mannaro Man;Dub, Instru;3;Am;135.998749
Wicked Soul - Feat Maïcee (Warrior Part);Adi Shankara, Maïcee;Dub, Vocal, Stepper;3;G#m;125.001541
Wicked and Bonny feat. Kali Green - 7' Culture Dub Records CDR008;Wicked and Bonny, Kali Green, Culture Dub;Dub, Heavy, Digital, Vocal;4;Cm;140.026138
Wild Vs Machine;Digiman Dub;Dub, Steppa ;2;Ebm;140.000534
Wild Walking (Extended Version);T-Horns, Organic Sound;Dub, Instru, Digital;3;Dm;70.000282
Little Angry Owl;WildSkank;Dub, Instru, Digital;3;;129.000458
Sea Monster;WildSkank;Dub, Instru, Digital;3;;140.0
Warrior Owl;WildSkank;Dub, Instru, ElectroDub, Steppa;4;;122.999817
Travel;Wildskank, Akira Dub;Dub, Instru, Digital, Steppa;3;;153.000595
Wind Of Organic;Organic Sound;Dub, Instru;3;Eb;60.00024
Wise Emperor [Part Vocal];Simba Khan, Warriah Dan;Dub, Vocal, Steppa, Reggae;2;Ebm;140.000244
Wising Dub;DPHdub;Dub, Instru;3;Gm;80.000206
Deep Inspiration;Wood Harmony;Dub, Vocal, Sample, Digital;3;Gm;136.000565
Wood's Dance;Digiman Dub;Dub, Instru;3;Fm;161.999985
Formaté;Woody Vibes;Dub, Instru, Digital, Electrodub;3;Ebm;70.999992
Woody Sphère (new mix);Woody Vibes;Dub, Instru, ElectroDub, Steppa, DubTek, Trance;4;;140.000427
DubQuakeRiddim Feat. SMAD - Tell Me;Wu.D'Sound, SMAD;Dub, Vocal, FR, Electrodub, Digital;4;Am;149.999695
Free Again;Wudub, Sennah;Dub, Vocal, Digital, Steppa;3;G#m;140.000671
WuduB¡¿ Skankin B and Little Lion MC - Last Post ;WuduB, Skankin B, Lion MC;Dub, Vocal, Steppa;4;Fm;139.999405
One Day Dem Haffi Fall (Lapo Remix);XL Mad, Lapo;Dub, Vocal, Digital;3;;140.0
Higher Dub RMX ft. dub_cmd;Xucar Warriors, dub_cmd;Dub, Instru, Digital, Steppa;3;F#m;74.999947
What's Wrong - What's Wrong Dub;YT, Iration Steppas;Dub, Heavy, Vocal, Steppa;4;Ebm;147.146301
Mr Politician;YT;Dub, Vocal, Digital, Reggae;2;Eb;80.000465
Ya Basta¡;Conscious Youth;Dub, Instru, Steppa;2;Gm;137.999741
Conquering Lion;Vivian Jackson and The Ralph Brothers;Dub, Vocal, OS;2;Em;68.17263
Yatraa;Tiburk Sound System;Dub, Instru, Steppa, Mélodique;3;Gm;140.00145
Dubpamine Babylon;Ylaow, Animal Terrenal Spectral Dub;Dub, Instru, Digital, Steppa;3;;135.000015
Steppa 3x Osc;YIaow;Dub, Steppa, Instru, Digital, Heavy;4;Bb;149.99881
Yoko;Tiburk;Dub, Vocal, Digital;3;Dm;139.999725
Young Girl ft Mc Joss & Atrz -Don Carlos Tribute - Bonus;Mc Joss, Artz, Ghana Sound;Dub, Vocal, Digital;2;2m;65.000023
Youths Dub feat. Likkle Dread - Remix;Zilla Dan, Likkle Dread;Dub, Vocal, Digital;3;Gm;138.000351
Rise Up - Art-X Remix;Yves Larock, Art-X;Dub, Vocal, Digital;3;Em;128.000153
ZION TRAIN ft. DAMAN - Money (PROPAGANDUB Remix) ZT30 Tribute;Zion Train, Daman, Propagandub;Dub, Vocal, Digital;3;Am;75.000229
Contraception ft. Ras Tinny - Steppas Records;Alpha Steppa, Ras Tinny;Dub, Vocal, Digital, Steppa;4;Ebm;140.001038
Stay (Panda Dub Remix);Panda Dub, Zenzile;Dub, Digital, Electrodub, Vocal;2;C#m;65.500229
Zion;Mushka Town;Dub, Instru, Digital;3;Am;145.000519
It's Alright - Ghana remix;Critical Hi-Fi, El Fata, Ghana Sound System;Dub, Vocal, Digital, Dubstep;4;Cm;74.410027
The Garden;Wudub!?, SKG's Dub Alliance;Dub, Digital, Vocal;3;Cm;140.000427
Way Back Home;Kasbar, JBWOY;Dub, Vocal, DnB, Digital;3;G#m;139.999863
Tonight;Turntable Dubbers, Skarra Muchi;Dub, Vocal, Digital;3;Cm;139.999283
Walk Like A Warrior ft. Jane Warriah / Crazy Hertz;Alpha Omega, Jane Warriah;Dub, Vocal, Digital, Steppa, Downtempo;3;Am;130.000198
9 Years ft. Don Fe Old Scotland Yard [Dub Dynasty] - streetdub E20;Alpha Steppa, Cian Finn, Don Fe;Dub, Vocal, Digital, Steppa, Heavy;4;Cm;140.000412
Clock Rmx Ft Tonto Irie, Joseph Cotton, Biga*Ranx, Green Cross & Jay Spaker;Atili, Tonto Irie, Joseph Cotton, Biga Ranx, Green Cross, Jay Speaker;Dub, Vocal, Digital, Dubadub;3;Bbm;177.999924
My Face (REMIX by ATILI & LIL SLOW);Atili, Biga Ranx;Dub, Vocal, Digital, Dubadub, Electrodub;3;Gm;160.000183
Paris is a Bitch (REMIX by ATILI);Atili, Biga Ranx;Dub, Vocal, Digital, Dubadub, Electrodub, Steppa;3;Em;139.999878
Brutal skunk;Mexican Stepper;Dub, Instru, Digital, Steppa;3;;141.999573
Melodies - In The Box Session 7 (season 2);Charlie P, OBF;Dub, Vocal, ElectroDub, Steppa, Dubadub;4;4m;133.0
dark fog ;KingFly;Dub, Instru, ElectroDub, Steppa;3;;136.999512
darker stronger dubber 2.0;Mahom;Dub, Vocal, ElectroDub, Steppa;4;;137.999954
Dela Move;Chronixx;Dub, Vocal, Digital;3;Am;69.999641
Digitalize it;Spiralskank;Dub, Instru, Digital, Steppa;4;Ebm;140.002853
Dub en mousse;Mad Skanker;Dub, Instru, Steppa, Digital, Heavy;4;Fm;72.49968
Magnetic Riddim;dub_cmd;Dub, Instru, Digital, Heavy;3;Fm;150.669067
His Foundation - Prince David - Moa Anbessa;Dub Legend;Dub, Vocal, OS;3;Cm;126.828125
Strong man;i.rebel, vibe k;Dub, Vocal, Digital;3;Gm;135.999115
Dub Ambulance;I Rebel, Original Dawa;Dub, Vocal, Digital, Dubadub;3;Em;131.999832
indica dub;The Ragga Panda;Dub, Instru, Digital;3;G#m;116.999832
Jarring;Skunk Kut;Dub, Instru, ElectroDub;3;;59.998058
Musical Murder;Johnny Osbourne;Dub, Vocal, OS, Digital ;4;Ebm;168.199142
JULES I-JAH A DI BEST - MOA ANBESSA;Moa Anbessa, Jules I;Dub, Vocal, OS;3;Fm;133.163025
Sunny Days;Kanka;Dub, Instru, Digital, Heavy;3;Gm;69.499901
Top of the Mountain _ Lyrical Benjie;Dubcreator, King Shiloh;Dub, Vocal, OS;4;1m;140.557465
Le Bonheur;L'Entourloop, Panda Dub;Dub, Vocal, Sample, FR, Digital;4;Am;69.999786
My Story;Manudigital, Panda Dub, Royal;Dub, Vocal, Digital, Electrodub, Heavy;5;Ebm;162.00058
Trip 2 Garda;MGDK, I-Rebel;Dub, Vocal, Digital;3;10m;140.000107
Do nuh play - dub version ( prod. by boombardub );Mehdiman, Boombardub;Dub, Vocal, Digital;3;;72.50042
"Milton Blake - Love Vehicle 7"" - Humble Rumble Sound System (2019) - Channel One Killer!";Kasus_Music;Dub, Vocal, OS;3;G#m;143.603088
A DUB A DI BEST;Moa Anbessa;Dub, OS, Steppa;3;Fm;66.592972
Nightskank;KingFly;Dub, Instru;3;;145.999725
Urban Style;OBF, Martin Campbell;Dub, Digital, Vocal;4;Em;148.993988
First Meet;Panda Dub, Youyou;Dub, Vocal, Digital;3;Gm;131.999817
poorman style;Prince David;Dub, Vocal, OS;2;Eb;62.499958
crisis-I-II..wmv;Pupajim, Stand High Patrol;Dub, Vocal, Digital, Steppa;4;C#m;139.986176
rainydub;Mé2dub;Dub, Instru, Melodic, Steppa;3;Em;61.499676
slowdubby2;Mé2dub;Dub, Instru, Digital, Steppa;3;Fm;146.000778
Far from Home;Soom T;Dub, Vocal, Digital, Dubadub;3;Gm;148.000839
Ma Croix;Biga Ranx;Dub, Vocal, FR, Digital, Dubadub, ElectroDub;3;4m;84.000343
La Lune;Biga Ranx;Dub, Vocal, FR, Digital, Dubadub;2;12m;69.999985
Gotta Learn;Biga Ranx;Dub, Vocal, Digital, Reggae, Chill;2;C#m;78.000175
Mad Move;Biga Ranx;Dub, Vocal, FR, Digital, ElectroDub;4;Dm;133.999527
Big Plane;Biga Ranx;Dub, Vocal, FR, Digital, Dubadub, ElectroDub;2;Bbm;148.000305
Sunshine Soldier;Biga Ranx;Dub, Vocal, Digital, Chill;2;Am;88.000374
Berlin Everything;Biga Ranx;Dub, Vocal, Digital, Chill;3;Bbm;97.000099
Ma Petite Ville;Biga Ranx;Dub, Vocal, FR, Digital, Chill;2;C#m;102.999893
Gravity;Ashkabad, After All;Dub, Vocal, Digital, Electrodub, Steppa;4;Cm;140.000015
Gravity (Brainless Remix);Ashkabad;Dub, Vocal, Digital, ElectroDub;4;Cm;209.999664
Gravity - Krak In Dub Remix;Krak In Dub, After All;Dub, Vocal, ElectroDub, DnB;3;Cm;139.999954
Gravity - Ondubground Remix;Ondubground, After All;Dub, Vocal, ElectroDub, DubTek;3;Am;70.000145
In Time;Aklea Neon, Anja G, Chakka, Damien Prophet, Dr Obi;Dub, Vocal, ElectroDub, Steppa;3;;140.00061
Outrank;Aklea Neon, Dr Obi;Dub, Vocal, ElectroDub, Steppa;3;;140.000061
Vampire;Anja G, Dr Obi;Dub, Vocal, ElectroDub, Steppa;3;;140.000092
Angry Tune;Chakka, Dr Obi;Dub, Vocal, Digital, Steppa;3;;70.000023
Timless Dubsrtumental;Dr Obi;Dub, Instru, Digital, Steppa;3;;140.000092
Ruff Times;Dr Obi;Dub, Instru, ElectroDub, Steppa, Heavy;4;;140.000626
Raggamuffin Jah Billah Rmx (instrumental mix);Jah Billah;Dub, Instru, Digital, ElectroDub, Uptempo;3;G#m;171.699936
Raggamuffin Jah Billah Rmx (vocal mix);Jah Billah, Anja G;Dub, Vocal, Digital, ElectroDub, Uptempo;3;G#m;171.700684
Bangstrumental Sheco Rmx (instrumental mix);Sheco;Dub, Instru, Digital, ElectroDub, DnB;3;Am;87.500114
Bang Bang Sheco Rmx (vocal mix);Sheco, Anja G;Dub, Vocal, Digital, ElectroDub, DnB;3;Fm;87.49926
Sky It A Go Red;Dubble, Anja G;Dub, Vocal, Digital;3;Gm;67.499954
Dub It A Go Red;Dubble, Anja G;Dub, Instru, Digital;3;Gm;67.500038
Melodica Driver;Dubble;Dub, Instru, Digital, Melodica;3;Gm;67.5
Dub the Driver;Dubble, Mr Obi;Dub, Instru, Digital, ElectroDub, Dirty;3;Gm;67.5
Dub Rider;Dubble, Mr Obi;Dub, Instru, Digital, ElectroDub;3;Gm;67.499931
Ay Carmela - Anja G;Anja G, Dr Obi;Dub, Vocal, Digital;2;Ebm;145.002716
Dub Carmela - Dr.obi;Anja G, Dr Obi;Dub, Instru, Digital;3;Dm;145.004745
BangBang - Anja G & Dr.obi;Anja G, Dr Obi;Dub, Vocal, Digital, ElectroDub, Steppa;3;Bbm;144.001602
DubBang -  Dr.obi;Anja G, Dr Obi;Dub, Instru, Digital, ElectroDub, Steppa;3;Bbm;144.002136
Raggamuffin - Anja G & Dr.obi;Anja G, Dr Obi;Dub, Vocal, Digital, ElectroDub;3;G#m;85.850388
Dub a muffin - Dr.obi;Anja G, Dr Obi;Dub, Vocal, Digital, ElectroDub;3;G#m;85.850792
Juggling - Anja G meets Mexican Stepper & Dr.Obi;Anja G, Mexican Stepper, Dr Obi;Dub, Vocal, Digital, ElectroDub, Steppa;4;Cm;139.999924
Dub Juggling - Anja G meets Mexican Stepper & Dr.Obi;Anja G, Mexican Stepper, Dr Obi;Dub, Instru, Digital, ElectroDub, Steppa;4;Cm;140.000534
CLOUD CHASING (Ft Yanushka);Atili, Yanushka;Dub, Vocal, Digital, ElectroDub;2;Ebm;139.998993
MISFIT;Atili;Dub, Instru, Digital, ElectroDub;3;Ebm;130.000061
DRILLS (Ft Schlachthofbronx);Atili, Schlachthofbronx;Dub, Instru, Digital, ElectroDub;3;Fm;65.499367
TRAP OUT;Atili;Dub, Vocal, Digital, ElectroDub;3;Em;122.999146
MARIE JANE (Ft Speng Bond);Atili, Speng Bond;Dub, Vocal, Digital, ElectroDub, DubTek;3;G#m;155.001328
50 CENTIMES (Ft Biga*Ranx);Atili, Biga Ranx;Dub, Vocal, Digital, ElectroDub, Dubadub;3;Am;134.001373
ECATEPEC (Ft Canto Yalalteco);Atili, Canto Yalalteco;Dub, Vocal, Digital, ElectroDub;3;G#m;129.999985
THIS MIC (Ft Jodybigfoot & Lil Slow);Atili, Jodybigfoot, Lil Slow;Dub, Vocal, Digital, ElectroDub, Rap;3;Am;127.00042
DURAG & DIAMANT (Ft Roi Heenok);Atili, Roi Heenok;Rap, Vocal, Digital, Electro;3;Bm;188.000702
LE BINKS (Ft Biffty);Atili, Biffty;Dub, Vocal, Rap, FR Digital, ElectroDub;3;Gm;70.000114
DAFA NEXX (Ft Lidiop);Atili, Lidiop;Dub, Vocal, Digital, ElectroDub;2;Em;87.999413
SNOOZIN';Atili;Dub, Vocal, Digital, ElectroDub;2;Em;129.999664
FALLAH (Ft Biffty);Atili, Biffty;Dub, Vocal, Rap, FR Digital, ElectroDub;2;Dm;61.500175
Willow Tree feat Alton Ellis (#Special);Atili, Alton Ellis;Dub, Vocal, Digital, Chill;2;Em;83.000191
Stinkin' Rich feat Gappy Ranks (#Special);Atili, Gappy Ranks;Dub, Vocal, Digital, ElectroDub;3;Dm;83.000435
Bandelero feat Pinchers (#Special);Atili, Pinchers;Dub, Vocal, Digital, ElectroDub;3;Ebm;84.050034
Mr Bassie feat Horace Andy (#Special);Atili, Horace Handy;Dub, Vocal, Digital, ElectroDub;2;Am;77.000366
Ram It & Jam It feat Tonto Irie (#Special);Atili, Tonto Irie;Dub, Vocal, Digital, ElectroDub;3;G#m;90.000648
Up Town Style feat Lone Ranger (#Special);Atili, Lone Ranger;Dub, Vocal, Digital, ElectroDub, Steppa;3;Ebm;153.000214
One Big Forward feat Max Romeo (#Special);Atili, Max Romeo;Dub, Vocal, Digital, ElectroDub;2;Em;130.000183
Rule this World feat Alton Ellis (#Special);Atili, Alton Ellis;Dub, Vocal, Digital, ElectroDub;2;Am;79.999977
Above the Mountains;Awoga;Dub, Instru, Digital, ElectroDub, Melodic;2;Bm;64.99942
Dreamscape;Awoga;Dub, Vocal, Digital, ElectroDub, Melodic;2;E;64.999939
Last Fly;Awoga;Dub, Instru, Digital, ElectroDub, Melodic;2;G#m;59.999882
Time Travelerz;Awoga;Dub, Instru, Digital, ElectroDub, Melodic;2;Fm;59.999786
Turn Around;Awoga;Dub, Instru, Digital, ElectroDub, Melodic;3;Fm;74.999542
Because - Woody Vibes Remix;Ondubground, Woddy Vibes;Dub, Vocal, Digital, ElectroDub;3;Fm;140.000305
Tetra Hydro Booster (Woody Vibes Remix);Tetra Hydro K, Woody Vibes;Dub, Instru, Digital, ElectroDub, Steppa;3;Gm;153.999695
Psychotic Symphony (Woody Vibes Remix);Panda Dub, Woody Vibes;Dub, Instru, Digital, ElectroDub, Progressive, Dubstep;4;Gm;140.000504
No Man Stand Alone;Baltimores, La Bouture Dub;Dub, Vocal, Digital, Melodic;2;Fm;66.500153
No Dub Stand Alone;Baltimores, La Bouture Dub;Dub, Vocal, Digital, Melodic;2;Fm;133.000626
No Man Stand Alone (Instrumental);Baltimores, La Bouture Dub;Dub, Instru, Digital, Melodic;2;Fm;66.500099
Keep On Fighting;Barbes D, Mo'kalamity;Reggae, Vocal, Digital;2;Am;146.001495
Musicians - dub version;Barbes D, Joseph Cotton;Dub, Vocal, Digital;2;G#m;90.000168
Musicians;Barbes D, Joseph Cotton;Reggae, Vocal, Digital, Dub;2;G#m;89.999931
Corruption;Barbes D, S'Kaya;Reggae, Vocal, Digital, Dubadub, Dub;2;Bbm;88.000031
Dub Games;Barbés.D, Jennifer Paulos;Reggae, Vocal, Digital, Dub;2;Cm;89.999901
Lead The Fight Dub;Barbés.D, Naïma Mansri;Dub, Instru, Digital, ElectroDub;2;Bbm;137.998917
Tell Dem Again;Barbes D, Little R;Reggae, Dub, Vocal, Digital, Dubadub;2;Gm;129.999924
Run For Nothing;Barbes D, Don Camilo;Reggae, Vocal, Digital;3;Eb;89.999947
MP3 Land;Barbes D;Dub, Instru, Digital;3;Cm;129.999893
20m2;Barbes D;Dub, Instru, Digital;2;Cm;67.994423
Reminder (Black Hole Remix);Black Hole Sound System, Saah Karim;Dub, Vocal, Digital, Steppa;3;;120.000099
Lets go To zion (Black Hole Remix);Black Hole Sound System, Winston Francis;Dub, Vocal, Digital;3;;133.79953
Rootsman;Brother Culture, Derrick Sound;Dub, Vocal, Digital, Steppa;3;;145.000839
Rootsman Dub;Brother Culture, Derrick Sound;Dub, Instru, Digital, Steppa;3;;145.000626
Dub O Waya;Emanuel, The Bionites;Dub, Instru, OS;2;B;108.545517
Rock Town;Ballistic Bunny, Vicky;Dub, Vocal;2;Ebm;120.000038
Jungle dub;Jungle's Echo;Dub, Instru, Reggae;2;Dm;94.999519
Dem Can't Stop Jah Works;Warbass Records, Sgt Juggler, Joshua Bailey;Dub, Vocal;2;Em;86.249908
Freaky dub;Gary Clunk, Dub Machinist;Dub, Instru, Digital;3;Bbm;79.999733
Young Colors;Ksanti;Dub, Instru, Digital, Mélodique;3;Cm;149.99971
No War;Travelerz;Dub, Vocal, Digital;3;Bbm;70.000313
No Limit version VI;Simple Man, Bud Warrior;Dub, Instru, Progressive;2;Em;120.000519
Worldwide Mess;The Subvivors;Dub, Instru, Digital, ElectroDub, Dubstep;3;Am;67.499901
Cultural Youth;Kandee, Ishabel;Dub, Vocal, Digital;3;Fm;77.499893
No Permission;Ginette Prod;Dub, Instru, Digital, Steppa;3;Fm;143.999664
Concrete;Keen Owl;Dub, Instru, Digital, ElectroDub;3;G#m;119.999916
Livity;Zion Rave;Dub, Instru, Steppa;3;Em;142.000046
The Leper King;Dawood Riddim Force;Dub, Instru, Digital;3;Cm;139.999954
Millenium;Spiral Skank;Dub, Instru, Digital;3;Em;140.000778
Mr Policeman;Feldub;Dub, Instru, Digital, ElectroDub;3;Em;139.999847
Deafening Keys;Stepper Sons;Dub, Instru, Digital, ElectroDub;4;Cm;69.000389
Half Time;Roots Zombie;Dub, Vocal, Digital, ElectroDub, Dubstep;5;G#m;87.500076
Stopper Dubplate;Low-K, Da D Man;Dub, Vocal, Digital, ElectroDub, Dnb;3;Em;171.000198
ODDBALL JACK;Ckrows Sound;Dub, Instru, Digital, ElectroDub, Steppa, Uptempo, Dirty;4;F#m;173.000916
FUCKDUB;Ckrows Sound;Dub, Instru, Digital, ElectroDub, Steppa, Uptempo, Dirty;4;G#m;90.000031
ANGRY CROWS;Ckrows Sound;Dub, Instru, Digital, ElectroDub, Steppa, Uptempo, Dirty;4;Gm;171.000046
JACK'S TRIP;Ckrows Sound;Dub, Instru, Digital, ElectroDub, Steppa, Uptempo;3;Bbm;91.00029
VIBE [ON];Ckrows Sound;Dub, Instru, Digital, ElectroDub, DubTek, Uptempo;3;Ebm;178.000305
SICK BRAIN;Ckrows Sound;Dub, Instru, Digital, ElectroDub, DubTek, Uptempo, Dirty;4;Em;184.999924
THE LAST RISE OF THE CKROW;Ckrows Sound;Dub, Instru, Digital, ElectroDub, Steppa, Uptempo, Dirty;4;Bbm;177.000488
BLACK HOLE;D2S Hifi;Dub, Vocal, Sample, ElectroDub;3;;141.999649
DUB HOLE;D2S Hifi;Dub, Vocal, Sample, ElectroDub;3;;141.999268
SPACE HOLE;D2S Hifi;Dub, Vocal, Sample, ElectroDub;3;;120.000969
BLACK HOLE RUFF MIX;D2S Hifi;Dub, Instru, ElectroDub;3;;150.001328
Dub Fashion (Original Mix);DIY Sound;Dub, Vocal, Digital;3;;71.999725
Dub Fashion (Feldub Remix);DIY Sound, Feldub;Dub, Vocal, Digital, Steppa;3;;71.999893
Dub Fashion (Gary Clunk Remix);DIY Sound, Gary Clunk;Dub, Instru, Digital, Steppa;3;;144.0
Dub Fashion (Phoniandflore Remix);DIY Sound, Phoniandflore;Dub, Vocal, Digital, Steppa;3;;143.99939
MINDS DUB;Dub Invasion Records;Dub, Instru, Steppa;3;;64.000267
PERFECT MINDS;Nish Wadada;Dub, Vocal, Digital, Dirty;3;;63.999657
Jah Iration;Mighty Prophet, Dub Iration Sound System;Dub, Instru, Digital;3;;130.999786
Green Herb;Dubzoic, Idren Natural, Dub Iration Sound System;Dub, Vocal, Digital, Steppa;3;;70.00045
Fiyah a Burn;Jah Free, Dub Iration Sound System;Dub, Vocal, Digital, ElectroDub;4;;138.004776
Nazarite;Vibronics, Dub Iration Sound System;Dub, Instru, Digital;4;;137.000046
See;Massada, Bethsab, Dub Iration Sound System;Dub, Vocal, Digital;3;;142.000198
Revelation Dub, Part 4;Tsunami Wazahari, Saimn-I, Dub Iration Sound System;Dub, Instru;3;;127.999931
Wilder Chants;Dr. Dubious, Ras Mat I, Dub Iration Sound System;Dub, Vocal, Digital;3;;140.000137
So Far Evil;Variedub, Burian Fyah, Dub Iration Sound System;Dub, Vocal, Digital;2;;119.997925
Nuff Robber;Dub Caravan, Med Dred, Dub Iration Sound System;Dub, Vocal, Reggae;2;;62.814331
Under Pressure;Nucleus Roots, Dub Iration Sound System;Dub, Vocal, Digital, Steppa;3;;130.000488
Jah Arise (Rebel Town remix);ADUBta, Dan Imperial, Dub Iration Sound System;Dub, Vocal, Digital;2;;130.000244
Trouble a Bubble;Zion Train, Cian Finn, Dub Iration Sound System;Dub, Vocal, Digital, ElectroDub;3;;160.001266
Grrr;DU3normal, Dub Iration Sound System;Dub, Instru, Modique;3;;132.001617
Chemtrails Must Be Stopped;Ras Moa, Dub Iration Sound System;Dub, Vocal, Sample;3;;137.999878
Slaves of Ren;Dagga General;Dub, Vocal, Digital, ElectroDub;3;C;61.499935
Per Nesou;Dagga General;Dub, Instru, Digital, ElectroDub;3;G#m;130.999649
Negul Neshai;Dagga General;Dub, Vocal, Digital, ElectroDub;3;G#m;131.389053
Primal Uprising;Dagga General;Dub, Instru, Digital, ElectroDub, Steppa;4;Am;71.499886
Righteous Man;Danman, Indica Dubs, Forward Fever;Dub, Vocal, Digital, ElectroDub, Steppa;3;Dm;70.000008
Dubplate Mix;Danman, Indica Dubs, Forward Fever;Dub, Instru, Digital, ElectroDub, Steppa;3;Dm;69.999977
Raw Dub Mix;Danman, Indica Dubs, Forward Fever;Dub, Instru, Digital, Steppa;4;Bbm;69.999924
Dub and Culture;Alex Sci-Fi;Dub, Vocal, Digital, Steppa;3;Ebm;146.000641
Roots and Culture;Dixie Peach, Alex Sci-Fi;Dub, Vocal, Digital, Steppa;3;Ebm;145.999664
Corruption;Dixie Peach, Mr Zebre;Dub, Vocal, Digital, ElectroDub, Steppa;4;Cm;147.00087
Never Give Up;Dixie Peach, Péah;Dub, Vocal, Digital, Steppa;3;Bbm;137.000458
Warrior;Dixie Peach, Tozer;Dub, Vocal, Digital, Steppa;4;Am;75.999939
Dub Corrupted;Mr Zebre;Dub, Vocal, Digital, Steppa;4;Ebm;147.000687
Never Give Dub;Péah;Dub, Instru, Digital, Steppa;4;Bbm;137.001022
Warrior Dub;Tozer;Dub, Vocal, Digital, Steppa;4;Am;75.999908
Guidance;Dr Obi, Anja G;Dub, Vocal, Digital, ElectroDub;3;Gm;122.000206
Guidance in Dub;Dr Obi, Anja G;Dub, Instru, Digital, ElectroDub;3;Gm;122.000328
Guidance Dubwise;Dr Obi, Anja G;Dub, Instru, Digital, ElectroDub, Dirty;4;Gm;122.000854
Bun Dem - Anja G;Anja G;Dub, Vocal, Digital, ElectroDub, Steppa;3;Am;153.003616
Dub Dem - Dr Obdi;Dr.Obi, Queen Omega, Anja G, Tenna Star;Dub, Instru, Digital, ElectroDub, Steppa;3;Am;153.003677
Fyah Burning - Queen Omega;Queen Omega;Dub, Vocal, Digital, ElectroDub, Steppa;3;Am;153.004181
Liberation - Tenna Star;Tenna Star;Dub, Vocal, Digital, ElectroDub, Steppa;3;Am;153.003876
Dub Atao;DuBoLoGy;Dub, Instru, Digital;3;Cm;139.001175
Black Monday;DuBoLoGy;Dub, Instru, Digital, ElectroDub;3;C#m;70.0
Freakonomics Dub;DuBoLoGy;Dub, Instru, Digital, ElectroDub;3;Em;68.000252
Chacha Dub;DuBoLoGy;Dub, Instru, Digital;3;Am;150.000473
Dub Action;DuBoLoGy;Dub, Instru, Digital, ElectroDub;3;F#m;138.000168
Walk In Forest;DuBoLoGy;Dub, Instru, Digital;3;Ebm;137.99939
